{
  "$schema": "https://luhtech.dev/schemas/roadmap-business.schema.json",
  "$id": "urn:luhtech:example:file:roadmap-business",
  "schemaVersion": "1.0.0",
  "ventureId": "example",
  "lastUpdated": "2026-01-27T00:00:00Z",
  "meta": {
    "sourceOfTruth": ".roadmap/roadmap-business.json",
    "migratedFrom": [],
    "schemaChangelog": [
      {"version": "1.0.0", "date": "2026-01-27", "changes": ["Initial template creation"]}
    ]
  },
  "organizationName": "Example Venture",
  "mission": "To demonstrate enterprise-grade business roadmap documentation for luh-tech ventures.",
  "vision": "Become the reference implementation for schema-first business planning across the portfolio.",
  "currentStage": "pre-seed",
  "overallProgress": 25,
  "financials": {
    "preSeed": "$500K",
    "preSeedTiming": "Q2_2026",
    "preSeedUse": {
      "engineering": "60%",
      "operations": "25%",
      "marketing": "15%"
    },
    "seed": "$2M",
    "seedTiming": "Q4_2026",
    "seedUse": {
      "engineering": "50%",
      "sales": "30%",
      "operations": "20%"
    },
    "year1Revenue": "$500K ARR",
    "burnRate": "$30K/mo",
    "runway": 18,
    "pilotValueProjection": {
      "perProject": "$50K-$100K",
      "roi": "300%",
      "paybackPeriod": "3 months"
    }
  },
  "team": {
    "current": 3,
    "q2_2026_target": 5,
    "q4_2026_target": 8,
    "q2_2027_target": 12,
    "keyHires": [
      {"role": "Senior Backend Engineer", "quarter": "Q2_2026", "critical": true, "skills": ["Python", "PostgreSQL", "API Design"]},
      {"role": "Product Designer", "quarter": "Q3_2026", "critical": false, "skills": ["Figma", "UX Research", "Design Systems"]},
      {"role": "Sales Lead", "quarter": "Q4_2026", "critical": true, "skills": ["Enterprise Sales", "Construction Industry"]}
    ],
    "departments": {
      "engineering": {"current": 2, "target": 6},
      "product": {"current": 1, "target": 2},
      "sales": {"current": 0, "target": 3},
      "operations": {"current": 0, "target": 1}
    }
  },
  "competitive": {
    "directCompetitors": ["Competitor A", "Competitor B"],
    "indirectCompetitors": ["Spreadsheets", "Manual Processes", "Generic PM Tools"],
    "moats": [
      "Schema-first architecture enabling rapid iteration",
      "Deep construction industry expertise",
      "AI-native design from day one"
    ],
    "differentiators": [
      {"feature": "Enterprise Excellence", "description": "Production-grade from MVP", "competitorStatus": "Not available"},
      {"feature": "Schema-First", "description": "All data validated against canonical schemas", "competitorStatus": "Ad-hoc implementations"},
      {"feature": "No Shortcuts", "description": "Complete traceability and documentation", "competitorStatus": "Limited audit trails"}
    ]
  },
  "serviceTiers": {
    "starter": {
      "name": "Starter",
      "target": "Small contractors and freelancers",
      "pricing": {"base": "$0", "includes": "Basic features", "billing": "free"},
      "features": ["Up to 3 projects", "Basic reporting", "Community support"],
      "limits": {"projects": 3, "users": 1, "storage": "1GB"}
    },
    "professional": {
      "name": "Professional",
      "target": "Growing construction firms",
      "pricing": {"base": "$99/mo", "includes": "All starter features plus advanced", "billing": "monthly"},
      "features": ["Unlimited projects", "Advanced analytics", "Priority support", "API access"],
      "limits": {"projects": -1, "users": 10, "storage": "50GB"}
    },
    "enterprise": {
      "name": "Enterprise",
      "target": "Large contractors and enterprise clients",
      "pricing": {"base": "Custom", "includes": "Full platform access with dedicated support", "billing": "custom"},
      "features": ["Unlimited everything", "Dedicated support", "Custom integrations", "SLA guarantees", "On-premise option"],
      "limits": {"projects": -1, "users": -1, "storage": "Unlimited"}
    }
  },
  "graphMetadata": {
    "nodeType": "BusinessRoadmap",
    "inEdges": [],
    "outEdges": []
  }
}
